{
    "theme_name": "copper_patina",
    "road_glow_strength": 0.0,
    "typography_tracking": 2,
    "grain_strength": 0.12,
    "vignette_strength": 0.18,
    "texture_strength": 0.1,
    "color_grading_strength": 0.15,
    "gradient_strength": 0.3,
    "road_core_widths": {
        "motorway": 1.0,
        "primary": 0.8,
        "secondary": 0.6,
        "tertiary": 0.45,
        "residential": 0.35,
        "path": 0.2,
        "default": 0.35
    },
    "road_casing_widths": {
        "motorway": 1.3,
        "primary": 1.0,
        "secondary": 0.0,
        "tertiary": 0.0,
        "residential": 0.0,
        "path": 0.0,
        "default": 0.0
    }
}
