{
    "theme_name": "blueprint",
    "road_glow_strength": 0.0,
    "typography_tracking": 1,
    "grain_strength": 0.0,
    "vignette_strength": 0.0,
    "road_core_widths": {
        "motorway": 0.8,
        "primary": 0.6,
        "secondary": 0.5,
        "tertiary": 0.4,
        "default": 0.3
    },
    "road_casing_widths": {
        "motorway": 0.0,
        "primary": 0.0,
        "secondary": 0.0,
        "tertiary": 0.0,
        "default": 0.0
    }
}
